id,name,unit,data_type,description,createdAt,updatedAt,code,coverage,timespan,datasetId,sourceId,shortUnit,columnOrder,originalMetadata
72,"Total population (Gapminder, HYDE & UN)",,numeric,"Population by country, available from 1800 to 2019 based on Gapminder data, HYDE, and UN Population Division (2019) estimates.",7/23/15 3:52,9/13/19 10:46,\N,,,70,301,\N,0,\N
192,Freedom of the Press Status,,order,,1/23/16 23:05,5/13/19 9:35,\N,Global by country,1979-2014,152,85,\N,0,\N
349,Life satisfaction in Cantril Ladder (World Happiness Report 2019),,numeric,"Average of survey responses to the 'Cantril Ladder' question in the Gallup World Poll. The survey question asks respondents to think of a ladder, with the best possible life for them being a 10, and the worst possible life being a 0. ",1/1/16 0:00,5/8/19 11:27,\N,Global by country,2005-2016,235,201,\N,0,\N
358,"Human Rights Score (Schnakenberg & Fariss, 2014; Fariss, 2019)",,numeric,"The Human Rights Score provides a measure of the protection of the physical integrity of citizens. It aims to measure how a government protects its citizens' physical integrity, by taking into account torture, government killing, political imprisonment, extrajudicial executions, mass killings and disappearances. Its values range from  −3.8 to around 5.4 (the higher the better). It is constructed from an econometric model with data from nine sources.",1/1/16 0:00,6/11/19 0:42,\N,"Globally, by country and world average",1949 - 2014,241,208,\N,0,\N
1316,Human Development Index (UNDP),(0-1; higher values are better),numeric,"The Human Development Index (HDI) is a summary measure of average achievement in key dimensions of human development: a long and healthy life, being knowledgeable and have a decent standard of living. \
\
Measured by:\
\
– Life expectancy at birth\
\
– Mean years of schooling & Expected years of schooling\
\
– GNI per capita (in PPP adjusted international-$)\
\
The HDI is the geometric mean of normalized indices for each of the three dimensions.",1/1/16 0:00,5/8/19 16:01,\N,Global by country,,275,283,\N,0,\N
1405,Corruption Perception Index - Transparency International (2018),,numeric,"Annual ranking of countries by their perceived levels of corruption, as determined by expert assessments and opinion surveys. Scale is from 100 (very clean) to 0 (highly corrupt). ",10/11/16 2:19,5/7/19 14:58,\N,,2012-2015,305,408,\N,0,\N
1769,Cumulative CO2 emissions (OWID based on GCP & CDIAC (2018)),million tonnes,numeric,"Cumulative carbon dioxide (CO₂) emissions is the total quantity of CO₂ emissions emitted from 1751 until a given year, measured in tonnes. This is based on territorial emissions, which do not account for emissions embedded in traded goods. ",4/25/17 21:03,7/19/19 9:36,\N,global by country,,445,567,\N,0,\N
2098,Land area (sq. km),sq. km,numeric,"Land area is a country's total area, excluding area under inland water bodies, national claims to continental shelf, and exclusive economic zones. In most cases the definition of inland water bodies includes major rivers and lakes.",7/6/17 8:22,12/11/18 20:12,AG.LND.TOTL.K2,,1960-2017,554,760,sq. km,0,\N
2118,Population density (people per sq. km of land area),people per sq. km of land area,numeric,"Population density is midyear population divided by land area in square kilometers. Population is based on the de facto definition of population, which counts all residents regardless of legal status or citizenship--except for refugees not permanently settled in the country of asylum, who are generally considered part of the population of their country of origin. Land area is a country's total area, excluding area under inland water bodies, national claims to continental shelf, and exclusive economic zones. In most cases the definition of inland water bodies includes major rivers and lakes.",7/6/17 8:22,12/11/18 20:12,EN.POP.DNST,,1960-2017,554,780,people,0,\N
2130,Rural population,,numeric,Rural population refers to people living in rural areas as defined by national statistical offices. It is calculated as the difference between total population and urban population. Aggregation of urban and rural population may not add up to total population because of different country coverages.,7/6/17 8:22,12/11/18 20:12,SP.RUR.TOTL,,1960-2017,554,792,\N,0,\N
2137,Terrestrial protected areas (% of total land area),% of total land area,numeric,"Terrestrial protected areas are totally or partially protected areas of at least 1,000 hectares that are designated by national authorities as scientific reserves with limited public access, national parks, natural monuments, nature reserves or wildlife sanctuaries, protected landscapes, and areas managed mainly for sustainable use. Marine areas, unclassified areas, littoral (intertidal) areas, and sites protected under local or provincial law are excluded.",7/6/17 8:22,12/11/18 20:12,ER.LND.PTLD.ZS,,1960-2017,554,799,%,0,\N
2145,Urban population,,numeric,Urban population refers to people living in urban areas as defined by national statistical offices. It is calculated using World Bank population estimates and urban ratios from the United Nations World Urbanization Prospects. Aggregation of urban and rural population may not add up to total population because of different country coverages.,7/6/17 8:22,12/11/18 20:12,SP.URB.TOTL,,1960-2017,554,807,\N,0,\N
2146,Urban population (% of total),% of total,numeric,Urban population refers to people living in urban areas as defined by national statistical offices. The data are collected and smoothed by United Nations Population Division.,7/6/17 8:22,12/11/18 20:12,SP.URB.TOTL.IN.ZS,,1960-2017,554,808,%,0,\N
2697,Secure Internet servers (per 1 million people),per 1 million people,numeric,"The number of distinct, publicly-trusted TLS/SSL certificates found in the Netcraft Secure Server Survey.",7/6/17 8:32,12/11/18 20:12,IT.NET.SECR.P6,,1960-2017,556,1359,\N,0,\N
2945,Time required to start a business (days),days,numeric,"Time required to start a business is the number of calendar days needed to complete the procedures to legally operate a business. If a procedure can be speeded up at additional cost, the fastest procedure, independent of cost, is chosen.",7/6/17 8:45,12/11/18 20:12,IC.REG.DURS,,1960-2017,559,1607,days,0,\N
3020,"Employment to population ratio, 15+, female (%) (modeled ILO estimate)",modeled ILO estimate,numeric,"Employment to population ratio is the proportion of a country's population that is employed. Employment is defined as persons of working age who, during a short reference period, were engaged in any activity to produce goods or provide services for pay or profit, whether at work during the reference period (i.e. who worked in a job for at least one hour) or not at work due to temporary absence from a job, or to working-time arrangements. Ages 15 and older are generally considered the working-age population.",7/6/17 8:50,12/11/18 20:12,SL.EMP.TOTL.SP.FE.ZS,,1960-2017,560,1682,\N,0,\N
3035,"Labor force participation rate, female (% of female population ages 15+) (modeled ILO estimate)",modeled ILO estimate,numeric,Labor force participation rate is the proportion of the population ages 15 and older that is economically active: all people who supply labor for the production of goods and services during a specified period.,7/6/17 8:50,12/11/18 20:12,SL.TLF.CACT.FE.ZS,,1960-2017,560,1697,\N,0,\N
3041,"Labor force, female (% of total labor force)",% of total labor force,numeric,Female labor force as a percentage of the total show the extent to which women are active in the labor force. Labor force comprises people ages 15 and older who supply labor for the production of goods and services during a specified period.,7/6/17 8:50,12/11/18 20:12,SL.TLF.TOTL.FE.ZS,,1960-2017,560,1703,%,0,\N
3043,Net migration,,numeric,"Net migration is the net total of migrants during the period, that is, the total number of immigrants less the annual number of emigrants, including both citizens and noncitizens. Data are five-year estimates.",7/6/17 8:50,12/11/18 20:12,SM.POP.NETM,,1960-2017,560,1705,\N,0,\N
3044,Ratio of female to male labor force participation rate (%) (modeled ILO estimate),modeled ILO estimate,numeric,Labor force participation rate is the proportion of the population ages 15 and older that is economically active: all people who supply labor for the production of goods and services during a specified period. Ratio of female to male labor force participation rate is calculated by dividing female labor force participation rate by male labor force participation rate and multiplying by 100.,7/6/17 8:50,12/11/18 20:12,SL.TLF.CACT.FM.ZS,,1960-2017,560,1706,\N,0,\N
3049,"Unemployment, female (% of female labor force) (modeled ILO estimate)",modeled ILO estimate,numeric,Unemployment refers to the share of the labor force that is without work but available for and seeking employment.,7/6/17 8:50,12/11/18 20:12,SL.UEM.TOTL.FE.ZS,,1960-2017,560,1711,\N,0,\N
3051,"Unemployment, male (% of male labor force) (modeled ILO estimate)",modeled ILO estimate,numeric,Unemployment refers to the share of the labor force that is without work but available for and seeking employment.,7/6/17 8:50,12/11/18 20:12,SL.UEM.TOTL.MA.ZS,,1960-2017,560,1713,\N,0,\N
3053,"Unemployment, total (% of total labor force) (modeled ILO estimate)",modeled ILO estimate,numeric,Unemployment refers to the share of the labor force that is without work but available for and seeking employment.,7/6/17 8:50,12/11/18 20:12,SL.UEM.TOTL.ZS,,1960-2017,560,1715,\N,0,\N
3064,Employment in agriculture (% of total employment) (modeled ILO estimate),modeled ILO estimate,numeric,"Employment is defined as persons of working age who were engaged in any activity to produce goods or provide services for pay or profit, whether at work during the reference period or not at work due to temporary absence from a job, or to working-time arrangement. The agriculture sector consists of activities in agriculture, hunting, forestry and fishing, in accordance with division 1 (ISIC 2) or categories A-B (ISIC 3) or category A (ISIC 4).",7/6/17 8:50,12/11/18 20:12,SL.AGR.EMPL.ZS,,1960-2017,560,1726,\N,0,\N
3065,"Employment in agriculture, female (% of female employment) (modeled ILO estimate)",modeled ILO estimate,numeric,"Employment is defined as persons of working age who were engaged in any activity to produce goods or provide services for pay or profit, whether at work during the reference period or not at work due to temporary absence from a job, or to working-time arrangement. The agriculture sector consists of activities in agriculture, hunting, forestry and fishing, in accordance with division 1 (ISIC 2) or categories A-B (ISIC 3) or category A (ISIC 4).",7/6/17 8:50,12/11/18 20:12,SL.AGR.EMPL.FE.ZS,,1960-2017,560,1727,\N,0,\N
3066,"Employment in agriculture, male (% of male employment) (modeled ILO estimate)",modeled ILO estimate,numeric,"Employment is defined as persons of working age who were engaged in any activity to produce goods or provide services for pay or profit, whether at work during the reference period or not at work due to temporary absence from a job, or to working-time arrangement. The agriculture sector consists of activities in agriculture, hunting, forestry and fishing, in accordance with division 1 (ISIC 2) or categories A-B (ISIC 3) or category A (ISIC 4).",7/6/17 8:50,12/11/18 20:12,SL.AGR.EMPL.MA.ZS,,1960-2017,560,1728,\N,0,\N
3067,Employment in industry (% of total employment) (modeled ILO estimate),modeled ILO estimate,numeric,"Employment is defined as persons of working age who were engaged in any activity to produce goods or provide services for pay or profit, whether at work during the reference period or not at work due to temporary absence from a job, or to working-time arrangement. The industry sector consists of mining and quarrying, manufacturing, construction, and public utilities (electricity, gas, and water), in accordance with divisions 2-5 (ISIC 2) or categories C-F (ISIC 3) or categories B-F (ISIC 4).",7/6/17 8:50,12/11/18 20:12,SL.IND.EMPL.ZS,,1960-2017,560,1729,\N,0,\N
3068,"Employment in industry, female (% of female employment) (modeled ILO estimate)",modeled ILO estimate,numeric,"Employment is defined as persons of working age who were engaged in any activity to produce goods or provide services for pay or profit, whether at work during the reference period or not at work due to temporary absence from a job, or to working-time arrangement. The industry sector consists of mining and quarrying, manufacturing, construction, and public utilities (electricity, gas, and water), in accordance with divisions 2-5 (ISIC 2) or categories C-F (ISIC 3) or categories B-F (ISIC 4).",7/6/17 8:50,12/11/18 20:12,SL.IND.EMPL.FE.ZS,,1960-2017,560,1730,\N,0,\N
3069,"Employment in industry, male (% of male employment) (modeled ILO estimate)",modeled ILO estimate,numeric,"Employment is defined as persons of working age who were engaged in any activity to produce goods or provide services for pay or profit, whether at work during the reference period or not at work due to temporary absence from a job, or to working-time arrangement. The industry sector consists of mining and quarrying, manufacturing, construction, and public utilities (electricity, gas, and water), in accordance with divisions 2-5 (ISIC 2) or categories C-F (ISIC 3) or categories B-F (ISIC 4).",7/6/17 8:50,12/11/18 20:12,SL.IND.EMPL.MA.ZS,,1960-2017,560,1731,\N,0,\N
3070,Employment in services (% of total employment) (modeled ILO estimate),modeled ILO estimate,numeric,"Employment is defined as persons of working age who were engaged in any activity to produce goods or provide services for pay or profit, whether at work during the reference period or not at work due to temporary absence from a job, or to working-time arrangement. The services sector consists of wholesale and retail trade and restaurants and hotels; transport, storage, and communications; financing, insurance, real estate, and business services; and community, social, and personal services, in accordance with divisions 6-9 (ISIC 2) or categories G-Q (ISIC 3) or categories G-U (ISIC 4).",7/6/17 8:50,12/11/18 20:12,SL.SRV.EMPL.ZS,,1960-2017,560,1732,\N,0,\N
3071,"Employment in services, female (% of female employment) (modeled ILO estimate)",modeled ILO estimate,numeric,"Employment is defined as persons of working age who were engaged in any activity to produce goods or provide services for pay or profit, whether at work during the reference period or not at work due to temporary absence from a job, or to working-time arrangement. The services sector consists of wholesale and retail trade and restaurants and hotels; transport, storage, and communications; financing, insurance, real estate, and business services; and community, social, and personal services, in accordance with divisions 6-9 (ISIC 2) or categories G-Q (ISIC 3) or categories G-U (ISIC 4).",7/6/17 8:50,12/11/18 20:12,SL.SRV.EMPL.FE.ZS,,1960-2017,560,1733,\N,0,\N
3072,"Employment in services, male (% of male employment) (modeled ILO estimate)",modeled ILO estimate,numeric,"Employment is defined as persons of working age who were engaged in any activity to produce goods or provide services for pay or profit, whether at work during the reference period or not at work due to temporary absence from a job, or to working-time arrangement. The services sector consists of wholesale and retail trade and restaurants and hotels; transport, storage, and communications; financing, insurance, real estate, and business services; and community, social, and personal services, in accordance with divisions 6-9 (ISIC 2) or categories G-Q (ISIC 3) or categories G-U (ISIC 4).",7/6/17 8:50,12/11/18 20:12,SL.SRV.EMPL.MA.ZS,,1960-2017,560,1734,\N,0,\N
3327,Proportion of seats held by women in national parliaments (%),%,numeric,Women in parliaments are the percentage of parliamentary seats in a single or lower chamber held by women.,7/6/17 8:59,12/11/18 20:12,SG.GEN.PARL.ZS,,1960-2017,562,1989,%,0,\N
3342,Mothers are guaranteed an equivalent position after maternity leave (1=yes; 0=no),1=yes; 0=no,binary,"Mothers are guaranteed an equivalent position after maternity leave is whether employers of women returning from maternity leave are legally obligated to provide them with an equivalent position after maternity leave. It takes into account paid and unpaid maternity leave and captures whether the employer has a legal obligation to reinstate the returning employee in an equivalent or better position and salary than the employee had pre-leave. Where the maternity leave regime explicitly states that the employee may not be indefinitely replaced, the answer is assumed to be “Yes.” Where the maternity leave regime explicitly establishes a suspension of the employee’s contract, the answer is assumed to be “Yes.” In economies that also have parental leave and the law guarantees return after the leave to the same or an equivalent position paid at the same rate but is silent on guaranteeing the same position after maternity leave, the answer is “Yes.” The answer is “N/A” if no paid or unpaid maternity leave is available.",7/6/17 8:59,12/11/18 20:12,SG.MMR.LEVE.EP,,1960-2017,562,2004,\N,0,\N
3343,Nonpregnant and nonnursing women can do the same jobs as men (1=yes; 0=no),1=yes; 0=no,binary,"Non-pregnant and non-nursing women can do the same jobs as men indicates whether there are specific jobs that women explicitly or implicitly cannot perform except in limited circumstances. Both partial and full restrictions on women’s work are counted as restrictions. For example, if women are only allowed to work in certain jobs within the mining industry, e.g., as health care professionals within mines but not as miners, this is a restriction.",7/6/17 8:59,12/11/18 20:12,SG.JOB.NOPN.EQ,,1960-2017,562,2005,\N,0,\N
3345,Age dependency ratio (% of working-age population),% of working-age population,numeric,Age dependency ratio is the ratio of dependents--people younger than 15 or older than 64--to the working-age population--those ages 15-64. Data are shown as the proportion of dependents per 100 working-age population.,7/6/17 9:03,12/11/18 20:12,SP.POP.DPND,,1960-2017,563,2007,%,0,\N
3346,"Age dependency ratio, old (% of working-age population)",% of working-age population,numeric,"Age dependency ratio, old, is the ratio of older dependents--people older than 64--to the working-age population--those ages 15-64. Data are shown as the proportion of dependents per 100 working-age population.",7/6/17 9:03,12/11/18 20:12,SP.POP.DPND.OL,,1960-2017,563,2008,%,0,\N
3347,"Age dependency ratio, young (% of working-age population)",% of working-age population,numeric,"Age dependency ratio, young, is the ratio of younger dependents--people younger than 15--to the working-age population--those ages 15-64. Data are shown as the proportion of dependents per 100 working-age population.",7/6/17 9:03,12/11/18 20:12,SP.POP.DPND.YG,,1960-2017,563,2009,%,0,\N
3361,Diabetes prevalence (% of population ages 20 to 79),% of population ages 20 to 79,numeric,Diabetes prevalence refers to the percentage of people ages 20-79 who have type 1 or type 2 diabetes.,7/6/17 9:03,12/11/18 20:12,SH.STA.DIAB.ZS,,1960-2017,563,2023,%,0,\N
3373,"Immunization, DPT (% of children ages 12-23 months)",% of children ages 12-23 months,numeric,"Child immunization, DPT, measures the percentage of children ages 12-23 months who received DPT vaccinations before 12 months or at any time before the survey. A child is considered adequately immunized against diphtheria, pertussis (or whooping cough), and tetanus (DPT) after receiving three doses of vaccine.",7/6/17 9:03,12/11/18 20:12,SH.IMM.IDPT,,1960-2017,563,2035,%,0,\N
3375,"Immunization, measles (% of children ages 12-23 months)",% of children ages 12-23 months,numeric,"Child immunization, measles, measures the percentage of children ages 12-23 months who received the measles vaccination before 12 months or at any time before the survey. A child is considered adequately immunized against measles after receiving one dose of vaccine.",7/6/17 9:03,12/11/18 20:12,SH.IMM.MEAS,,1960-2017,563,2037,%,0,\N
3394,"Mortality rate, infant (per 1,000 live births)","per 1,000 live births",numeric,"Infant mortality rate is the number of infants dying before reaching one year of age, per 1,000 live births in a given year.",7/6/17 9:03,12/11/18 20:12,SP.DYN.IMRT.IN,,1960-2017,563,2056,\N,0,\N
3395,"Mortality rate, infant, female (per 1,000 live births)","per 1,000 live births",numeric,"Infant mortality rate, female is the number of female infants dying before reaching one year of age, per 1,000 female live births in a given year.",7/6/17 9:03,12/11/18 20:12,SP.DYN.IMRT.FE.IN,,1960-2017,563,2057,\N,0,\N
3396,"Mortality rate, infant, male (per 1,000 live births)","per 1,000 live births",numeric,"Infant mortality rate, male is the number of male infants dying before reaching one year of age, per 1,000 male live births in a given year.",7/6/17 9:03,12/11/18 20:12,SP.DYN.IMRT.MA.IN,,1960-2017,563,2058,\N,0,\N
3397,"Mortality rate, neonatal (per 1,000 live births)","per 1,000 live births",numeric,"Neonatal mortality rate is the number of neonates dying before reaching 28 days of age, per 1,000 live births in a given year.",7/6/17 9:03,12/11/18 20:12,SH.DYN.NMRT,,1960-2017,563,2059,\N,0,\N
3398,"Mortality rate, under-5 (per 1,000 live births)","per 1,000 live births",numeric,"Under-five mortality rate is the probability per 1,000 that a newborn baby will die before reaching age five, if subject to age-specific mortality rates of the specified year.",7/6/17 9:03,6/4/19 5:09,SH.DYN.MORT,,1960-2017,563,2060,\N,0,\N
3399,"Mortality rate, under-5, female (per 1,000 live births)","per 1,000 live births",numeric,"Under-five mortality rate, female is the probability per 1,000 that a newborn female baby will die before reaching age five, if subject to female age-specific mortality rates of the specified year.",7/6/17 9:03,12/11/18 20:12,SH.DYN.MORT.FE,,1960-2017,563,2061,\N,0,\N
3400,"Mortality rate, under-5, male (per 1,000 live births)","per 1,000 live births",numeric,"Under-five mortality rate, male is the probability per 1,000 that a newborn male baby will die before reaching age five, if subject to male age-specific mortality rates of the specified year.",7/6/17 9:03,12/11/18 20:12,SH.DYN.MORT.MA,,1960-2017,563,2062,\N,0,\N
3448,"Population, female (% of total)",% of total,numeric,"Female population is the percentage of the population that is female. Population is based on the de facto definition of population, which counts all residents regardless of legal status or citizenship.",7/6/17 9:03,12/11/18 20:12,SP.POP.TOTL.FE.ZS,,1960-2017,563,2110,%,0,\N
3449,"Population, total",,numeric,"Total population is based on the de facto definition of population, which counts all residents regardless of legal status or citizenship. The values shown are midyear estimates.",7/6/17 9:03,12/11/18 20:12,SP.POP.TOTL,,1960-2017,563,2111,\N,0,\N
3485,Number of infant deaths,,numeric,Number of infants dying before reaching one year of age.,7/6/17 9:03,12/11/18 20:12,SH.DTH.IMRT,,1960-2017,563,2147,\N,0,\N
3486,Number of neonatal deaths,,numeric,Number of neonates dying before reaching 28 days of age.,7/6/17 9:03,12/11/18 20:12,SH.DTH.NMRT,,1960-2017,563,2148,\N,0,\N
3488,Number of under-five deaths,,numeric,Number of children dying before reaching age five.,7/6/17 9:03,12/11/18 20:12,SH.DTH.MORT,,1960-2017,563,2150,\N,0,\N
8621,WHO region,,category,"WHO Member Countries are grouped into six regions, called WHO regions.",8/1/17 16:11,2/28/18 8:58,\N,Global ,2017,659,2809,\N,0,\N
42452,Universal suffrage to women (OWID based on Paxton et al (2006)),,binary,"Right to vote to all women in a country, granted in that year or any previous year. The values are coded as Yes and No. ",9/14/17 12:36,2/28/18 8:58,\N,Global by country ,1893-2017,927,6786,\N,0,\N
42453,First women in parliament (OWID based on Paxton et al (2006)),,binary,"First female member of parliament (MP) in a country, elected in that year or any previous year. The values are coded as Yes and No. ",9/14/17 12:36,2/28/18 8:58,\N,Global by country,1893-2017,927,6786,\N,0,\N
42454,10% Share of women in parliament (OWID based on Paxton et al (2006)),,binary,"At least 10% of seats in a country's parliament occupied by women, in that year or any previous year. The values are coded as Yes and No. ",9/14/17 12:36,2/28/18 8:58,\N,Global by country,1893-2017,927,6786,\N,0,\N
42455,20% Share of women in parliament (OWID based on Paxton et al (2006)),,binary,"At least 20% of seats in a country's parliament occupied by women, in that year or any previous year. The values are coded as Yes and No. ",9/14/17 12:36,2/28/18 8:58,\N,Global by country,1893-2017,927,6786,\N,0,\N
42456,30% Share of women in parliament (OWID based on Paxton et al (2006)),,binary,"At least 30% of seats in a country's parliament occupied by women, in that year or any previous year. The values are coded as Yes and No. ",9/14/17 12:36,2/28/18 8:58,\N,Global by country,1893-2017,927,6786,\N,0,\N
42619,World Region according to the World Bank,,category,,10/8/17 17:24,2/28/18 8:58,\N,,,960,6819,\N,0,\N
43198,Annual CO2 emissions (Global Carbon Project & CDIAC (2019)),million tonnes,numeric,Annual territorial emissions of carbon dioxide (CO₂) from fossil fuels and cement. ,11/14/17 12:12,8/19/19 15:03,\N,global by country,,1041,6896,\N,0,\N
56489,DALYs (Disability-Adjusted Life Years) - Conflict and terrorism - Sex: Both - Age: All Ages (Number),Number,numeric,\N,11/20/17 15:27,4/24/19 2:41,2 945 3 22 1,,,1455,12765,\N,0,\N
